"Section 9 in The Wild Life (Protection) Act, 1972",section 9,"Central Government ActSection 9 in The Wild Life (Protection) Act, 1972  1[9.  Prohibition of hunting.—No person shall hunt any wild animal specified in Schedules I, II, III and IV except as provided under section 11 and section 12.]"
"Section 145(2) in The Negotiable Instruments Act, 1881",section 145(2),"Central Government ActSection 145(2) in The Negotiable Instruments Act, 1881 (2)  The Court may, if it thinks fit, and shall, on the application of the prosecution or the accused, summon and examine any person giving evidence on affidavit as to the facts contained therein."
Section 473 in The Indian Penal Code,section 473,"Central Government ActSection 473 in The Indian Penal Code 473.  Making or possessing counterfeit seal, etc., with intent to commit forgery punishable otherwise.—Whoever makes or counterfeits any seal, plate or other instrument for making an impression, intend­ing that the same shall be used for the purpose of committing any forgery which would be punishable under any section of this Chapter other than section 467, or, with such intent, has in his possession any such seal, plate or other instrument, knowing the same to be counterfeit, shall be punished with imprisonment of either description for a term which may extend to seven years, and shall also be liable to fine."
Section 374 in The Indian Penal Code,section 374,"Central Government ActSection 374 in The Indian Penal Code 374.  Unlawful compulsory labour.—Whoever unlawfully compels any person to labour against the will of that person, shall be pun­ished with imprisonment of either description for a term which may extend to one year, or with fine, or with both."
Section 187 in The Indian Penal Code,section 187,"Central Government ActSection 187 in The Indian Penal Code 187.  Omission to assist public servant when bound by law to give assistance.—Whoever, being bound by law to render or furnish assistance to any public servant in the execution of his public duty, intentionally omits to give such assistance, shall be punished with simple imprisonment for a term which may extend to one month, or with fine which may extend to two hundred rupees, or with both; and if such assistance be demanded of him by a public servant legally competent to make such demand for the purposes of execut­ing any process lawfully issued by a Court of Justice, or of pre­venting the commission of an offence, or of suppressing a riot, or affray, or of apprehending a person charged with or guilty of an offence, or of having escaped from lawful custody, shall be pun­ished with simple imprisonment for a term which may extend to six months, or with fine which may extend to five hundred rupees, or with both."
Section 218 in The Indian Penal Code,section 218,"Central Government ActSection 218 in The Indian Penal Code 218.  Public servant framing incorrect record or writing with intent to save person from punishment or property from forfei­ture.—Whoever, being a public servant, and being as such public servant, charged with the preparation of any record or other writing, frames that record or writing in a manner which he knows to be incorrect, with intent to cause, or knowing it to be likely that he will thereby cause, loss or injury to the public or to any person, or with intent thereby to save, or knowing it to be likely that he will thereby save, any person from legal punish­ment, or with intent to save, or knowing that he is likely there­by to save, any property from forfeiture or other charge to which it is liable by law, shall be punished with imprisonment of either description for a term which may extend to three years, or with fine, or with both."
"Section 283(1)(c) in The Indian Succession Act, 1925",section 283(1)(c),"Central Government ActSection 283(1)(c) in The Indian Succession Act, 1925 (c)  issue citations calling upon all persons claiming to have any interest in the estate of the deceased to come and see the proceedings before the grant of probate or letters of administration."
Section 381 in The Indian Penal Code,section 381,"Central Government ActSection 381 in The Indian Penal Code 381.  Theft by clerk or servant of property in possession of master.—Whoever, being a clerk or servant, or being employed in the capacity of a clerk or servant, commits theft in respect of any property in the possession of his master or employer, shall be punished with imprisonment of either description for a term which may extend to seven years, and shall also be liable to fine."
Section 456 in The Indian Penal Code,section 456,"Central Government ActSection 456 in The Indian Penal Code 456.  Punishment for lurking house-trespass or house-breaking by night.—Whoever commits lurking house-trespass by night, or house-breaking by night, shall be punished with imprisonment of either description for a term which may extend to three years, and shall also be liable to fine."
